{
  "schemaVersion": 1,
  "corpusName": "Flow BLM Knowledge Source Vault",
  "createdAt": "2026-08-13",
  "status": "SOURCE_INVENTORY_READY",
  "task001GovernanceRequired": true,
  "sourceCount": 12,
  "missingSourceCount": 2,
  "sources": [
    {
      "sourceKey": "BLM-CORE-ARCHITECTURE-V1",
      "title": "Flow BLM Factual Business Architecture Library",
      "version": "v1",
      "knowledgeGroup": "GLOBAL_CORE",
      "repositoryPath": "knowledge/blm/sources/global-core/Flow_BLM_Factual_Business_Architecture_Library_v1.docx",
      "sourceType": "DOCX",
      "authorityClass": "FLOW_INTERNAL",
      "knowledgeUse": ["REFERENCE", "MAPPING", "CONTEXT", "EVALUATION"],
      "runtimeAvailability": true,
      "universalRuntimeKnowledge": true,
      "trainingEligibility": "TASK_001_GOVERNED",
      "commercialTrainingEligibility": "TASK_001_GOVERNED",
      "freshnessClass": "CURRENT",
      "sourceGovernanceRequired": true,
      "expectedTaskConsumers": ["TASK_007_1", "TASK_007_2"],
      "status": "AVAILABLE",
      "intendedUse": "Reference source for factual business architecture, entity, capability, and operating-model concepts.",
      "documentIsCanonicalTruth": false,
      "isSyntheticEvaluation": false,
      "isFlowInternal": false,
      "governanceMapping": {
        "businessSourceId": "source:blm-core-architecture-v1",
        "sourceReleaseId": "release:blm-core-architecture-v1:v1",
        "licenseProfileId": "license:flow-internal-task-001-governed",
        "seedCandidate": true,
        "mappedContracts": [
          "BusinessSource",
          "SourceRelease",
          "SourceLicenseProfile"
        ],
        "notes": "Prepared as a deterministic Task 001 seed candidate only. This manifest does not grant training or commercial training permission."
      },
      "fingerprint": "fd066da36f13b995af04fadfbbefc419107be3a8bc7eb30deaaa13970a3281f7"
    },
    {
      "sourceKey": "BLM-CORE-MATH-V3",
      "title": "Flow BLM Superintelligence Business Knowledge Mathematics Library",
      "version": "v3",
      "knowledgeGroup": "GLOBAL_CORE",
      "repositoryPath": "knowledge/blm/sources/global-core/Flow_BLM_Superintelligence_Business_Knowledge_Mathematics_Library_v3.docx",
      "sourceType": "DOCX",
      "authorityClass": "FLOW_INTERNAL",
      "knowledgeUse": ["REFERENCE", "MAPPING", "CONTEXT", "EVALUATION"],
      "runtimeAvailability": true,
      "universalRuntimeKnowledge": true,
      "trainingEligibility": "TASK_001_GOVERNED",
      "commercialTrainingEligibility": "TASK_001_GOVERNED",
      "freshnessClass": "CURRENT",
      "sourceGovernanceRequired": true,
      "expectedTaskConsumers": ["TASK_007_1", "TASK_007_2", "TASK_007_3"],
      "status": "AVAILABLE",
      "intendedUse": "Reference source for business metrics, formulas, deterministic calculation boundaries, and quantitative reasoning patterns.",
      "documentIsCanonicalTruth": false,
      "isSyntheticEvaluation": false,
      "isFlowInternal": false,
      "governanceMapping": {
        "businessSourceId": "source:blm-core-math-v3",
        "sourceReleaseId": "release:blm-core-math-v3:v3",
        "licenseProfileId": "license:flow-internal-task-001-governed",
        "seedCandidate": true,
        "mappedContracts": [
          "BusinessSource",
          "SourceRelease",
          "SourceLicenseProfile"
        ],
        "notes": "Prepared as a deterministic Task 001 seed candidate only. This manifest does not grant training or commercial training permission."
      },
      "fingerprint": "5d9d4fa507226978a851e42e4bb35e731c67afd66de4902898d96c77ff934700"
    },
    {
      "sourceKey": "BLM-LANGUAGE-V4",
      "title": "Flow BLM Business Language Execution Corpus",
      "version": "v4",
      "knowledgeGroup": "GLOBAL_CORE",
      "repositoryPath": "knowledge/blm/sources/global-core/Flow_BLM_Business_Language_Execution_Corpus_v4.docx",
      "sourceType": "DOCX",
      "authorityClass": "FLOW_INTERNAL",
      "knowledgeUse": ["REFERENCE", "MAPPING", "CONTEXT", "EVALUATION"],
      "runtimeAvailability": true,
      "universalRuntimeKnowledge": true,
      "trainingEligibility": "TASK_001_GOVERNED",
      "commercialTrainingEligibility": "TASK_001_GOVERNED",
      "freshnessClass": "CURRENT",
      "sourceGovernanceRequired": true,
      "expectedTaskConsumers": ["TASK_007_1", "TASK_007_2"],
      "status": "AVAILABLE",
      "intendedUse": "Reference source for canonical business language, aliases, CRUD/workflow semantics, roles, and execution wording.",
      "documentIsCanonicalTruth": false,
      "isSyntheticEvaluation": false,
      "isFlowInternal": false,
      "governanceMapping": {
        "businessSourceId": "source:blm-language-v4",
        "sourceReleaseId": "release:blm-language-v4:v4",
        "licenseProfileId": "license:flow-internal-task-001-governed",
        "seedCandidate": true,
        "mappedContracts": [
          "BusinessSource",
          "SourceRelease",
          "SourceLicenseProfile"
        ],
        "notes": "Prepared as a deterministic Task 001 seed candidate only. This manifest does not grant training or commercial training permission."
      },
      "fingerprint": "49ecfc7899113c9c21c61e9deefdba3454a636159a1c55513a2e80b57eccb172"
    },
    {
      "sourceKey": "BLM-EXPERTISE-V5",
      "title": "Flow BLM Global Business Industry Niche Expertise Psychology Strategy Library",
      "version": "v5",
      "knowledgeGroup": "GLOBAL_CORE",
      "repositoryPath": "knowledge/blm/sources/global-core/Flow_BLM_Industry_Niche_Expertise_Psychology_Strategy_Library_v5.docx",
      "sourceType": "DOCX",
      "authorityClass": "FLOW_INTERNAL",
      "knowledgeUse": ["REFERENCE", "MAPPING", "CONTEXT", "EVALUATION"],
      "runtimeAvailability": true,
      "universalRuntimeKnowledge": true,
      "trainingEligibility": "TASK_001_GOVERNED",
      "commercialTrainingEligibility": "TASK_001_GOVERNED",
      "freshnessClass": "CURRENT",
      "sourceGovernanceRequired": true,
      "expectedTaskConsumers": ["TASK_007_1", "TASK_007_3"],
      "status": "AVAILABLE",
      "intendedUse": "Reference source for cross-industry expertise packs, niche operating patterns, psychology-safe strategy context, and role-specific reasoning.",
      "documentIsCanonicalTruth": false,
      "isSyntheticEvaluation": false,
      "isFlowInternal": false,
      "governanceMapping": {
        "businessSourceId": "source:blm-expertise-v5",
        "sourceReleaseId": "release:blm-expertise-v5:v5",
        "licenseProfileId": "license:flow-internal-task-001-governed",
        "seedCandidate": true,
        "mappedContracts": [
          "BusinessSource",
          "SourceRelease",
          "SourceLicenseProfile"
        ],
        "notes": "Prepared as a deterministic Task 001 seed candidate only. This manifest does not grant training or commercial training permission."
      },
      "fingerprint": "7bb06e6216ff7febdfe17693ec4927046a42b314e30981b67c364e81c5c17380"
    },
    {
      "sourceKey": "BLM-TAXONOMY-V1",
      "title": "Flow BLM Global Business Taxonomy Context Architecture",
      "version": "v1",
      "knowledgeGroup": "GLOBAL_CORE",
      "repositoryPath": "knowledge/blm/sources/global-core/Flow_BLM_Global_Business_Taxonomy_Context_Architecture_v1.docx",
      "sourceType": "DOCX",
      "authorityClass": "FLOW_INTERNAL",
      "knowledgeUse": ["REFERENCE", "MAPPING", "CONTEXT", "EVALUATION"],
      "runtimeAvailability": true,
      "universalRuntimeKnowledge": true,
      "trainingEligibility": "TASK_001_GOVERNED",
      "commercialTrainingEligibility": "TASK_001_GOVERNED",
      "freshnessClass": "CURRENT",
      "sourceGovernanceRequired": true,
      "expectedTaskConsumers": ["TASK_007_1", "TASK_007_2"],
      "status": "AVAILABLE",
      "intendedUse": "Reference source for global business taxonomy, context selection, and domain classification.",
      "documentIsCanonicalTruth": false,
      "isSyntheticEvaluation": false,
      "isFlowInternal": false,
      "governanceMapping": {
        "businessSourceId": "source:blm-taxonomy-v1",
        "sourceReleaseId": "release:blm-taxonomy-v1:v1",
        "licenseProfileId": "license:flow-internal-task-001-governed",
        "seedCandidate": true,
        "mappedContracts": [
          "BusinessSource",
          "SourceRelease",
          "SourceLicenseProfile"
        ],
        "notes": "Prepared as a deterministic Task 001 seed candidate only. This manifest does not grant training or commercial training permission."
      },
      "fingerprint": "929dc1950dcbf28a9e715c684fdc2ae5576a81da5048bcce1c39a8c492f90ff1"
    },
    {
      "sourceKey": "BLM-MODULE-ARCH-V1",
      "title": "Flow BLM Business Operating System Module Building Block Architecture",
      "version": "v1",
      "knowledgeGroup": "GLOBAL_CORE",
      "repositoryPath": "knowledge/blm/sources/global-core/Flow_BLM_Business_Operating_System_Module_Building_Block_Architecture_v1.pdf",
      "sourceType": "PDF",
      "authorityClass": "FLOW_INTERNAL",
      "knowledgeUse": ["REFERENCE", "MAPPING", "CONTEXT", "EVALUATION"],
      "runtimeAvailability": true,
      "universalRuntimeKnowledge": true,
      "trainingEligibility": "TASK_001_GOVERNED",
      "commercialTrainingEligibility": "TASK_001_GOVERNED",
      "freshnessClass": "CURRENT",
      "sourceGovernanceRequired": true,
      "expectedTaskConsumers": ["TASK_007_1", "TASK_007_4"],
      "status": "AVAILABLE",
      "intendedUse": "Reference source for Business Operating System module boundaries, reusable building blocks, and module composition architecture.",
      "documentIsCanonicalTruth": false,
      "isSyntheticEvaluation": false,
      "isFlowInternal": false,
      "governanceMapping": {
        "businessSourceId": "source:blm-module-arch-v1",
        "sourceReleaseId": "release:blm-module-arch-v1:v1",
        "licenseProfileId": "license:flow-internal-task-001-governed",
        "seedCandidate": true,